<?xml version="1.0" encoding="UTF-8"?>
<Assignment xmlns:xsi="http://www.w3.org/2001/XMLSchema-instance"  xsi:noNamespaceSchemaLocation="Assignment.xsd">
	<Type>Homework</Type>
	<Assignment_ID>a</Assignment_ID>
	<Course_ID>0</Course_ID>
	<Student_ID>0</Student_ID>
	<Questions>
		<Question>
			<Section_ID>Section_ID</Section_ID>
			<Question_ID>Question_ID</Question_ID>
			<Content>Content</Content>
			<Answer>Answer</Answer>
			<Confidence>0</Confidence>
			<Points>13.0</Points>
			<IsReviewed>false</IsReviewed>
			<IsForcedReview>false</IsForcedReview>
		</Question>
		<Question>
			<Section_ID>Section_ID</Section_ID>
			<Question_ID>Question_ID</Question_ID>
			<Content>Content</Content>
			<Answer>Answer</Answer>
			<Confidence>0</Confidence>
			<Points>2.0</Points>
			<IsReviewed>false</IsReviewed>
			<IsForcedReview>false</IsForcedReview>
		</Question>
		<Question>
			<Section_ID>Section_ID</Section_ID>
			<Question_ID>Question_ID</Question_ID>
			<Content>Content</Content>
			<Answer>Answer</Answer>
			<Confidence>0</Confidence>
			<Points>10.0</Points>
			<IsReviewed>false</IsReviewed>
			<IsForcedReview>false</IsForcedReview>
		</Question>
		<Question>
			<Section_ID>Section_ID</Section_ID>
			<Question_ID>Question_ID</Question_ID>
			<Content>Content</Content>
			<Answer>Answer</Answer>
			<Confidence>0</Confidence>
			<Points>1.0</Points>
			<IsReviewed>false</IsReviewed>
			<IsForcedReview>false</IsForcedReview>
		</Question>
	</Questions>
</Assignment>
